{
  "schemaVersion": 1,
  "id": "summoning-and-hidden-cards",
  "order": 3,
  "title": "Summoning Ninjas & Playing Hidden Cards",
  "subtitle": "Placeholder subtitle.",
  "summary": "Placeholder summary.",
  "emblem": "mask",
  "accent": "mist",
  "estMinutes": 4,
  "steps": [
    {
      "id": "intro",
      "title": "Placeholder",
      "body": "Placeholder step mentioning [[AMBUSH]]."
    }
  ],
  "widget": {
    "id": "hidden-card-sim",
    "title": "Training ground",
    "brief": "Placeholder brief."
  },
  "quiz": [
    {
      "id": "q1",
      "prompt": "Placeholder?",
      "choices": [
        "Yes",
        "No"
      ],
      "answerIndex": 0,
      "explanation": "Placeholder."
    }
  ]
}
