{
  "schemaVersion": 1,
  "id": "the-edge-token",
  "order": 5,
  "title": "Winning with the Edge Token",
  "subtitle": "Placeholder subtitle.",
  "summary": "Placeholder summary.",
  "emblem": "edge",
  "accent": "chakra",
  "estMinutes": 4,
  "steps": [
    {
      "id": "intro",
      "title": "Placeholder",
      "body": "Placeholder step mentioning [[AMBUSH]]."
    }
  ],
  "widget": {
    "id": "edge-duel",
    "title": "Training ground",
    "brief": "Placeholder brief."
  },
  "quiz": [
    {
      "id": "q1",
      "prompt": "Placeholder?",
      "choices": [
        "Yes",
        "No"
      ],
      "answerIndex": 0,
      "explanation": "Placeholder."
    }
  ]
}
